,id,title,assignee,inventor,priority_date,filing_date,publication_date,grant_date,result_link,representative_figure_link,country,kind_code,abstract,cpc_1,cpc_2,cpc_3,cpc_1_num,cpc_2_num,cpc_3_num,file_grant_days,cpc_1_GHY
80,US11964426B2,Method and apparatus for continuous composite three-dimensional printing ,Continuous Composites Inc.,['Kenneth Lyle Tyler'],2012-08-29,2023-01-18,2024-04-23,2024-04-23,https://patents.google.com/patent/US11964426B2/en,https://patentimages.storage.googleapis.com/3f/38/e4/ae0dfb57edf9da/US11964426-20240423-D00000.png,US,B2,"A method and apparatus for the additive manufacturing of three-dimensional objects are disclosed. Two or more materials are extruded simultaneously as a composite, with at least one material in liquid form and at least one material in a solid continuous strand completely encased within the liquid material. A means of curing the liquid material after extrusion hardens the composite. A part is constructed using a series of extruded composite paths. The strand material within the composite contains specific chemical, mechanical, or electrical characteristics that instill the object with enhanced capabilities not possible with only one material.","['C', 'G', 'Y']","['C25', 'G06', 'Y02']","['C25B', 'G06Q', 'Y02E', 'Y02P', 'Y02W']",3,3,5,461,0
81,US11810533B2,Display device and electronic device ,"Semiconductor Energy Laboratory Co., Ltd.",['Akihiro Chida'],2016-12-22,2023-01-24,2023-11-07,2023-11-07,https://patents.google.com/patent/US11810533B2/en,https://patentimages.storage.googleapis.com/13/d2/ca/bc0acc3153f002/US11810533-20231107-D00000.png,US,B2,"A display device whose aspect ratio can be changed is provided. The display device includes a plurality of display units and a plurality of driver circuit units. The plurality of display units each include a light-emitting portion and a connection region. The plurality of driver circuit units each include a driver circuit portion and a connection region. The connection regions of the adjacent units overlap with each other and one shaft passes through the connection regions. The adjacent units are electrically connected to each other with the one shaft. With such a structure, an angle between the adjacent units electrically connected to each other with one shaft can be changed, which enables the aspect ratio of the display device to be changed.","['B', 'F', 'H', 'Y']","['B66', 'F03', 'H02', 'Y02']","['B66C', 'F03G', 'H02K', 'Y02E']",4,4,4,287,0
82,US11818194B2,"Apparatus, method and system for a tunneling client access point ","Ioengine, Llc",['Scott McNulty'],2004-03-23,2023-04-14,2023-11-14,2023-11-14,https://patents.google.com/patent/US11818194B2/en,https://patentimages.storage.googleapis.com/61/11/de/93fdb163e8ff67/US11818194-20231114-D00000.png,US,B2,"The disclosure details the implementation of an apparatus, method, and system comprising a portable device configured to communicate with a terminal and a network server, and execute stored program code in response to user interaction with an interactive user interface. The portable device contains stored program code configured to render an interactive user interface on a terminal output component to enable the user the control processing activity on the portable device and access data and programs from the portable device and a network server.","['B', 'H', 'Y']","['B63', 'B60', 'H01', 'H02', 'Y02']","['B63B', 'B60L', 'H01L', 'H02S', 'Y02E', 'Y02T']",3,5,6,214,0
83,US11859796B2,Light emitting diode recessed light fixture ,Signify Holding B.V.,"['Jerold Tickner', ' Scott David Wegner', ' Evans Edward Thompson', ' III']",2007-09-21,2023-01-26,2024-01-02,2024-01-02,https://patents.google.com/patent/US11859796B2/en,https://patentimages.storage.googleapis.com/e4/e3/ca/1bece8ea6654b0/US11859796-20240102-D00000.png,US,B2,"A recessed light fixture includes an LED module, which includes a single LED package that is configured to generate all light emitted by the recessed light fixture. For example, the LED package can include multiple LEDs mounted to a common substrate. The LED package can be coupled to a heat sink for dissipating heat from the LEDs. The heat sink can include a core member from which fins extend. Each fin can include one or more straight and/or curved portions. A reflector housing may be coupled to the heat sink and configured to receive a reflector. The reflector can have any geometry, such as a bell-shaped geometry including two radii of curvature that join together at an inflection point. An optic coupler can be coupled to the reflector housing and configured to cover electrical connections at the substrate and to guide light emitted by the LED package.","['G', 'H', 'Y']","['G05', 'H02', 'Y02']","['G05F', 'G05B', 'H02S', 'Y02E']",3,3,4,341,1
84,US11948300B2,"Machine learning systems and methods for assessment, healing prediction, and treatment of wounds ","Spectral Md, Inc.","['Wensheng Fan', ' John Michael DiMaio', ' Jeffrey E. Thatcher', ' Peiran Quan', ' Faliu Yi', ' Kevin Plant', ' Ronald Baxter', ' Brian McCall', ' Zhicun Gao', ' Jason Dwight']",2018-12-14,2023-03-02,2024-04-02,2024-04-02,https://patents.google.com/patent/US11948300B2/en,https://patentimages.storage.googleapis.com/32/4c/84/20732fe3c9a1e4/US11948300-20240402-D00000.png,US,B2,"Machine learning systems and methods are disclosed for prediction of wound healing, such as for diabetic foot ulcers or other wounds, and for assessment implementations such as segmentation of images into wound regions and non-wound regions. Systems for assessing or predicting wound healing can include a light detection element configured to collect light of at least a first wavelength reflected from a tissue region including a wound, and one or more processors configured to generate an image based on a signal from the light detection element having pixels depicting the tissue region, determine reflectance intensity values for at least a subset of the pixels, determine one or more quantitative features of the subset of the plurality of pixels based on the reflectance intensity values, and generate a predicted or assessed healing parameter associated with the wound over a predetermined time interval.","['H', 'Y']","['H01', 'H02', 'Y02', 'Y04']","['H01M', 'H02J', 'Y02E', 'Y04S']",2,4,4,397,0
85,US11980941B2,Method and apparatus for additive manufacturing with powder material ,Stratasys Ltd.,"['Yehoshua Sheinman', ' Shai Hirsch', ' Almog SHAHAR', ' Uri Grach', ' Kirill TANHILEVICH']",2016-04-11,2023-05-10,2024-05-14,2024-05-14,https://patents.google.com/patent/US11980941B2/en,https://patentimages.storage.googleapis.com/ba/fc/bb/1524456ae89df5/US11980941-20240514-D00000.png,US,B2,"A system for building a three dimensional green compact comprising a printing station configured to print a mask pattern on a building surface, wherein the mask pattern is formed of solidifiable material; a powder delivery station configured to apply a layer of powder material on the mask pattern; a die compaction station for compacting the layer formed by the powder material and the mask pattern; and a stage configured to repeatedly advance a building tray to each of the printing station, the powder delivery station and the die compaction station to build a plurality of layers that together form the three dimensional green compact.","['C', 'F', 'Y']","['C01', 'C02', 'C05', 'C12', 'F01', 'F25', 'Y02']","['C01B', 'C02F', 'C05D', 'C12M', 'F01K', 'F25J', 'Y02C', 'Y02E', 'Y02P', 'Y02W']",3,7,10,370,0
86,US11910701B2,Organic electroluminescent materials and devices ,Universal Display Corporation,"['Chuanjun Xia', ' Raymond C. Kwong', ' Suman Layek']",2009-03-23,2023-03-08,2024-02-20,2024-02-20,https://patents.google.com/patent/US11910701B2/en,https://patentimages.storage.googleapis.com/b2/73/8f/bb5c3fdae0a0fa/US11910701-20240220-D00000.png,US,B2,"Novel compounds comprising heteroleptic iridium complexes are provided. The compounds have a particular combination of ligands which includes a single pyridyl dibenzo-substituted ligand. The compounds may be used in organic light emitting devices, particularly as emitting dopants, to provide devices having improved efficiency, lifetime, and manufacturing.","['F', 'G', 'H', 'Y']","['F24', 'G05', 'H02', 'Y02', 'Y04']","['F24D', 'F24H', 'G05F', 'H02J', 'H02S', 'Y02B', 'Y02E', 'Y04S']",4,5,8,349,1
87,US11956838B1,Smart workstation method and system ,Steelcase Inc.,"['Darrin Sculley', ' Bo Anderson', ' Rachel Anne Neiman', ' Brandon Buckingham']",2016-06-03,2023-05-08,2024-04-09,2024-04-09,https://patents.google.com/patent/US11956838B1/en,https://patentimages.storage.googleapis.com/d5/a4/40/ae8dcf34207d27/US11956838-20240409-D00000.png,US,B1,"A system and method establishing control of affordances at a workstation. The method includes the steps of storing affordance preferences in a database for a plurality of portable affordance settings that may be present at a workstation, detecting a subset of affordances present within a first zone associated with the workstation, for each detected affordance in the subset, identifying an affordance setting in the database indicating a user preference, and automatically controlling settings of at least each of the detected affordances in the subset to match the user preferences for the detected affordances.","['B', 'F', 'Y']","['F28', 'B60', 'F24', 'F25', 'Y02']","['F28F', 'B60H', 'F24F', 'F25B', 'Y02A', 'Y02B']",3,5,6,337,0
88,US11747673B2,White light emitting device and display device using the same ,"Samsung Electronics Co., Ltd.","['Jong Pil JEON', ' Jong-Hoi Kim', ' Kye Hoon LEE', ' Dae-hee Lee', ' Byoung-jin CHO', ' Suk-ju CHOI']",2014-12-03,2023-01-05,2023-09-05,2023-09-05,https://patents.google.com/patent/US11747673B2/en,https://patentimages.storage.googleapis.com/db/20/b8/a00d307bd2d80d/US11747673-20230905-D00000.png,US,B2,"A white light emitting device, including a circuit board; a plurality of light sources mounted on the circuit board, each light source of the plurality of light sources configured to emit monochromatic light; a light converter spaced apart from the circuit board, the light converter configured to convert the monochromatic light emitted from the light sources to white light; and a compensator provided between the circuit board and the light converter, the compensator configured to convert the emitted monochromatic light to white light.","['G', 'H', 'Y']","['H02', 'G05', 'G06', 'Y02', 'Y04']","['H02J', 'G05B', 'G06Q', 'Y02B', 'Y02E', 'Y04S']",3,5,6,243,1
89,US11778870B2,"Display device, electronic apparatus, and method of fabricating the display device ","Semiconductor Energy Laboratory Co., Ltd.",['Shunpei Yamazaki'],2004-09-29,2023-01-09,2023-10-03,2023-10-03,https://patents.google.com/patent/US11778870B2/en,https://patentimages.storage.googleapis.com/ad/e0/31/401381bbe43b41/US11778870-20231003-D00000.png,US,B2,"It is an object of the invention to provide a technique to manufacture a display device with high image quality and high reliability at low cost with high yield. The invention has spacers over a pixel electrode layer in a pixel region and over an insulating layer functioning as a partition which covers the periphery of the pixel electrode layer. When forming a light emitting material over a pixel electrode layer, a mask for selective formation is supported by the spacers, thereby preventing the mask from contacting the pixel electrode layer due to a twist and deflection thereof. Accordingly, such damage as a crack by the mask does not occur in the pixel electrode layer. Thus, the pixel electrode layer does not have a defect in shapes, thereby a display device which performs a high resolution display with high reliability can be manufactured.","['G', 'Y']","['G06', 'G01', 'Y02']","['G06T', 'G01J', 'G01S', 'G01W', 'Y02B']",2,3,5,267,0
90,US11867911B2,Wearable devices and wearable assemblies with adjustable positioning for use in an optical measurement system ,Hi Llc,"['Scott Jeremy Seidman', ' Jennifer Rines', ' Ryan Field', ' Isai Olvera', ' Zachary Phillip Sheldon', ' Katherine Perdue']",2020-02-21,2023-02-03,2024-01-09,2024-01-09,https://patents.google.com/patent/US11867911B2/en,https://patentimages.storage.googleapis.com/c7/ab/e2/053dde9cdc6bb3/US11867911-20240109-D00000.png,US,B2,An optical measurement system includes a wearable device configured to be worn on a body of a user and a position alignment system. The wearable device includes a support assembly and a wearable assembly supported by the support assembly. The wearable assembly includes a plurality of light sources configured to emit a plurality of light pulses toward a target within the body of the user and a plurality of detectors each configured to receive a set of photons included in a light pulse included in the plurality of light pulses after the set of photons is scattered by the target. The position alignment system is configured to facilitate positioning of the wearable assembly at a same position on the body of the user during different use sessions of the wearable device.,"['F', 'G', 'H', 'Y']","['F03', 'G05', 'H02', 'H04', 'F05', 'Y02']","['F03D', 'G05F', 'H02J', 'H02S', 'H04L', 'F05B', 'Y02B', 'Y02E']",4,6,8,340,1
91,US11847578B2,Chatbot for defining a machine learning (ML) solution ,Oracle International Corporation,"['Alberto Polleri', ' Sergio Aldea Lopez', ' Marc Michiel Bron', ' Dan David Golding', ' Alexander Ioannides', ' Maria del Rosario Mestre', ' Hugo Alexandre Pereira Monteiro', ' Oleg Gennadievich Shevelev', ' Larissa Cristina Dos Santos Romualdo Suzuki', ' Xiaoxue Zhao', ' Matthew Charles Rowe']",2019-09-14,2023-01-23,2023-12-19,2023-12-19,https://patents.google.com/patent/US11847578B2/en,https://patentimages.storage.googleapis.com/dd/d8/ca/84004b39b141e5/US11847578-20231219-D00000.png,US,B2,"The present disclosure relates to systems and methods for an intelligent assistant (e.g., a chatbot) that can be used to enable a user to generate a machine learning system. Techniques can be used to automatically generate a machine learning system to assist a user. In some cases, the user may not be a software developer and may have little or no experience in either machine learning techniques or software programming. In some embodiments, a user can interact with an intelligent assistant. The interaction can be aural, textual, or through a graphical user interface. The chatbot can translate natural language inputs into a structural representation of a machine learning solution using an ontology. In this way, a user can work with artificial intelligence without being a data scientist to develop, train, refine, and compile machine learning models as stand-alone executable code.","['G', 'H', 'Y']","['G06', 'G05', 'H02', 'Y02', 'Y04']","['G06F', 'G05B', 'H02J', 'Y02B', 'Y02D', 'Y04S']",3,5,6,330,1
92,US11918783B2,Infusion pump system and methods ,Insulet Corporation,['Mark C. Estes'],2008-10-15,2023-04-20,2024-03-05,2024-03-05,https://patents.google.com/patent/US11918783B2/en,https://patentimages.storage.googleapis.com/67/19/7c/e3c72b86d20d89/US11918783-20240305-D00000.png,US,B2,"Some embodiments an infusion pump system can be configured to modify alarm limit parameters as the user's insulin load increases or decreases. Moreover, in particular embodiments, the infusion pump system can be configured to provide a âmissed bolusâ or âmissed mealâ alarm in response to the user's blood glucose characteristics, the user's insulin load information, or the like.","['A', 'F', 'Y']","['A45', 'F21', 'F24', 'Y02']","['A45B', 'F21V', 'F24F', 'F21S', 'F21W', 'Y02A', 'Y02B']",3,4,7,320,0
93,US11899615B2,Multiple dies hardware processors and methods ,Intel Corporation,"['Nevine Nassif', ' Yen-Cheng Liu', ' Krishnakanth V. Sistla', ' Gerald Pasdast', ' Siva Soumya Eachempati', ' Tejpal Singh', ' Ankush Varma', ' Mahesh K. Kumashikar', ' Srikanth Nimmagadda', ' Carleton L. Molnar', ' Vedaraman Geetha', ' Jeffrey D. Chamberlain', ' William R. Halleck', ' George Z Chrysos', ' John R. Ayers', ' Dheeraj R. Subbareddy']",2016-10-10,2023-01-27,2024-02-13,2024-02-13,https://patents.google.com/patent/US11899615B2/en,https://patentimages.storage.googleapis.com/df/37/c2/37c8e2bb74742a/US11899615-20240213-D00000.png,US,B2,"Methods and apparatuses relating to hardware processors with multiple interconnected dies are described. In one embodiment, a hardware processor includes a plurality of physically separate dies, and an interconnect to electrically couple the plurality of physically separate dies together. In another embodiment, a method to create a hardware processor includes providing a plurality of physically separate dies, and electrically coupling the plurality of physically separate dies together with an interconnect.","['B', 'G', 'H', 'Y']","['G06', 'B60', 'H02', 'Y02', 'Y04']","['G06Q', 'B60L', 'G06N', 'H02J', 'Y02E', 'Y02T', 'Y04S']",4,5,7,382,1
94,US11878993B2,Nucleotide analogues ,"Singular Genomics Systems, Inc.","['Ronald Graham', ' Olga ADELFINSKAYA', ' Megha Cila', ' Rodrigo Rodriguez', ' Abrehet Abdu', ' Eli N. Glezer']",2018-10-25,2023-04-04,2024-01-23,2024-01-23,https://patents.google.com/patent/US11878993B2/en,https://patentimages.storage.googleapis.com/6a/b7/f4/024dc5b935cb4f/US11878993-20240123-D00000.png,US,B2,"Disclosed herein, interalia, are compounds, compositions, and methods of using the same for the sequencing of a nucleic acid.","['F', 'Y']","['F04', 'F02', 'F03', 'F28', 'F25', 'Y02']","['F04B', 'F02C', 'F03D', 'F28D', 'F25B', 'Y02E']",2,6,6,294,0
95,US11902808B2,"Communication system, apparatus and related methods of operation ",Nec Corporation,['Dorin Panaitopol'],2013-08-06,2023-02-21,2024-02-13,2024-02-13,https://patents.google.com/patent/US11902808B2/en,https://patentimages.storage.googleapis.com/40/29/ea/d3659d1d2c1ae6/US11902808-20240213-D00000.png,US,B2,"A communication network system and related devices and method of monitoring in a mobile radio communications network environment direct communications between first and second mobile communication devices to provide to the network an indication of link-quality of the direct communication, wherein the network is arranged to configure at least one of the mobile radio communication devices with a link-quality parameter reference value, the said at least one mobile radio communications device can report to the network if it determines, relative to the said reference value, that the link-quality of the direct communication is insufficient, and if required the network can subsequently control communication between the said first and second mobile radio communication devices responsive to the reporting the received from the said at least one mobile radio communications device, or the network can employ the reporting from the said at least one mobile radio communications device for network planning/optimization purposes.","['G', 'H', 'Y']","['G06', 'G05', 'H02', 'Y02', 'Y04']","['G06Q', 'G05B', 'H02J', 'Y02B', 'Y02E', 'Y02P', 'Y04S']",3,5,7,357,1
96,US11902657B2,Systems and methods for automatic exposure in high dynamic range video capture systems ,Google Llc,"['William Duran', ' Adrian Proca']",2017-05-23,2023-02-23,2024-02-13,2024-02-13,https://patents.google.com/patent/US11902657B2/en,https://patentimages.storage.googleapis.com/64/15/58/42679eef39a6da/US11902657-20240213-D00000.png,US,B2,"The various implementations described herein include methods, devices, and systems for implementing high dynamic range and automatic exposure functions in a video system. In one aspect, a method is performed at a video camera device and includes, while operating in a non-high dynamic range (HDR) mode: capturing first video data of a scene with the image sensor; determining whether a minimum number of pixels of the first video data meets one or more first color intensity criteria; and in accordance with the determination that the minimum number of pixels of the first video data meets the one or more first color intensity criteria, switching operation from the non-HDR mode to an HDR mode.","['H', 'Y']","['H01', 'Y02']","['H01M', 'Y02E']",2,2,2,355,0
97,US11991919B2,Display device ,"Samsung Display Co., Ltd.","['Tae Woong Kim', ' Hyun Woo Koo', ' Young Gug Seol']",2013-08-12,2023-03-06,2024-05-21,2024-05-21,https://patents.google.com/patent/US11991919B2/en,https://patentimages.storage.googleapis.com/79/a3/15/4c5c8315e21e61/US11991919-20240521-D00000.png,US,B2,"A display device is disclosed. In one aspect, the display device includes a flexible substrate capable of being bent in a first direction and an insulating layer including a first opening pattern positioned on the flexible substrate and extending in a second direction crossing the first direction.","['B', 'G', 'H', 'Y']","['B60', 'G06', 'H02', 'Y02', 'Y04']","['B60L', 'G06Q', 'H02J', 'Y02E', 'Y02T', 'Y04S']",4,5,6,442,1
98,US11787269B2,Smart multi-modal vehicular air filtering system and associated methods ,Mann+Hummel Gmbh,"['Bernd Bauer', ' Thomas Heininger', ' Dominik Haider', ' Tobias Schwimmbeck', ' Mathias Hoesl', ' Matthias Heinzmann', ' Andreas Weber', ' Mirco Schoen', ' Mario Schoen', ' Martin Klein', ' Pascal Thau']",2017-06-06,2023-03-20,2023-10-17,2023-10-17,https://patents.google.com/patent/US11787269B2/en,https://patentimages.storage.googleapis.com/47/10/f6/fb3c53f2a03544/US11787269-20231017-D00000.png,US,B2,"A smart multi-modal vehicular air filtration management system including a first filter element and a second filter element disposed in a fresh air housing, wherein the fresh air housing has an inlet and an outlet. Additionally, a third filter element is provided which is disposed in a cabin housing, the cabin housing having one or more inlet. A fluid channel arranged between the fresh air and cabin housing. Finally, a diverter is included which is disposed near an outlet of the fresh air housing, wherein the diverter is configured to cause air to flow through the fresh air housing selectively through one or both of the first filter element and the second filter element.","['H', 'Y']","['H02', 'Y02']","['H02J', 'Y02E']",2,2,2,211,0
99,US11924279B2,Wireless transmission in shared wireless medium environments ,Ossia Inc.,"['Scott Elliott', ' Dale Mayes', ' Robert Giometti']",2018-05-01,2023-02-24,2024-03-05,2024-03-05,https://patents.google.com/patent/US11924279B2/en,https://patentimages.storage.googleapis.com/1c/45/47/15a97381c460d4/US11924279-20240305-D00000.png,US,B2,"Support of coexistence of wireless transmission equipment in shared wireless medium environments is disclosed, which is applicable to various types of wireless transmission equipment. For instance, a wireless power transmission system (WPTS) delivers power to wireless power receiver clients via transmission of wireless power signals using one or more frequencies and/or channels within shared wireless medium environments in which other wireless equipment is operating, such as access points and stations in wireless local area networks (WLANs). The WPTS is configured to co-exist with the operations of the other wireless equipment within the shared wireless medium environment by adapting its transmission operations to utilize frequencies or channels that do not interfere with other equipment and/or implementing co-channel and shared channels operations under which access to channels is implemented using standardized WLAN protocols such as PHY and MAC protocols used for 802.11 (Wi-Fiâ¢) networks.","['F', 'H', 'Y']","['H02', 'F24', 'Y02']","['H02S', 'F24S', 'Y02E']",3,3,3,375,0
100,US11954815B2,Anatomical model displaying ,"Affera, Inc.","['Doron Harlev', ' Geoffrey Peter Wright']",2016-05-03,2023-04-27,2024-04-09,2024-04-09,https://patents.google.com/patent/US11954815B2/en,https://patentimages.storage.googleapis.com/e7/79/b2/40b435c491ae43/US11954815-20240409-D00000.png,US,B2,"Systems and methods of automatically controlling, on a graphical user interface used by a physician, display views of an anatomic structure of a patient. Such systems and methods of automatically controlling display views of an anatomic structure of a patient can facilitate visualizing a position of a medical device relative to the anatomic structure during a medical procedure directed to the anatomic structure. In certain implementations, the systems and methods of the present disclosure provide automatic display views of a cardiac catheter relative to a three-dimensional model of a patient's heart cavity during a medical procedure such as cardiac ablation.","['F', 'Y']","['F25', 'F24', 'Y02']","['F25B', 'F24F', 'Y02A', 'Y02B']",2,3,4,348,0
