,id,title,assignee,inventor,priority_date,filing_date,publication_date,grant_date,result_link,representative_figure_link,country,kind_code,abstract,cpc_1,cpc_2,cpc_3,cpc_1_num,cpc_2_num,cpc_3_num,file_grant_days,cpc_1_GHY
0,US11967653B2,Phased solar power supply system ,"Ampt, Llc",['Anatoli Ledenev'],2013-03-15,2023-09-05,2024-04-23,2024-04-23,https://patents.google.com/patent/US11967653B2/en,https://patentimages.storage.googleapis.com/c0/ce/76/7fea0e524f1357/US11967653-20240423-D00000.png,US,B2,"A high efficiency solar power system combining photovoltaic sources of power ( ) can be converted by a base phase DC-DC photovoltaic converter ( ) and an altered phase DC-DC photovoltaic converter ( ) that have outputs combined through low energy storage combiner circuitry ( ). The converters can be synchronously controlled through a synchronous phase control ( ) that synchronously operates switches to provide a conversion combined photovoltaic DC output ( ). Converters can be provided for individual source conversion or phased operational modes, the latter presenting a combined low photovoltaic energy storage DC-DC photovoltaic converter ( ) at string or individual panel levels.","['F', 'G', 'H', 'Y']","['H02', 'F03', 'G05', 'F05', 'Y02']","['H02J', 'F03B', 'F03D', 'G05B', 'H02S', 'F05B', 'Y02E', 'Y02P']",4,5,8,231,1
1,US11867096B2,Calcination system with thermal energy storage system ,"Rondo Energy, Inc.","[""John Setel O'Donnell"", ' Peter Emery von Behrens', ' Chiaki Treynor', ' Jeremy Quentin Keller', ' Matthieu JONEMANN', ' Robert Ratz', ' Yusef Desjardins Ferhani']",2020-11-30,2023-02-20,2024-01-09,2024-01-09,https://patents.google.com/patent/US11867096B2/en,https://patentimages.storage.googleapis.com/35/06/4e/507b7c676ab62b/US11867096-20240109-D00000.png,US,B2,"An energy storage system converts variable renewable electricity (VRE) to continuous heat at over 1000Â° C. Intermittent electrical energy heats a solid medium. Heat from the solid medium is delivered continuously on demand. An array of bricks incorporating internal radiation cavities is directly heated by thermal radiation. The cavities facilitate rapid, uniform heating via reradiation. Heat delivery via flowing gas establishes a thermocline which maintains high outlet temperature throughout discharge. Gas flows through structured pathways within the array, delivering heat which may be used for processes including calcination, hydrogen electrolysis, steam generation, and thermal power generation and cogeneration. Groups of thermal storage arrays may be controlled and operated at high temperatures without thermal runaway via deep-discharge sequencing. Forecast-based control enables continuous, year-round heat supply using current and advance information of weather and VRE availability. High-voltage DC power conversion and distribution circuitry improves the efficiency of VRE power transfer into the system.","['B', 'F', 'H', 'Y']","['H02', 'B63', 'F03', 'F24', 'F05', 'Y02']","['H02N', 'B63B', 'F03B', 'F03D', 'F24S', 'H02K', 'H02S', 'F05B', 'Y02E']",4,6,9,323,0
2,US11757404B2,Coordinated control of renewable electric generation resource and charge storage device ,"8Me Nova, Llc","['Lukas Hansen', ' Philippe Garneau-Halliday', ' Gautham Ramesh', ' Bora Akyol', ' Brandon Carpenter', ' Rahul Mondal']",2019-02-08,2023-03-10,2023-09-12,2023-09-12,https://patents.google.com/patent/US11757404B2/en,https://patentimages.storage.googleapis.com/f6/22/bc/7b03d0308ca0cc/US11757404-20230912-D00000.png,US,B2,"A method includes generating a time-varying charge/discharge control signal for an electrical storage device, wherein generating the time-varying charge/discharge control signal comprises identifying a prioritization order of a stack of simultaneously operating control modes, the stack of simultaneously operating control modes including a staging mode and at least two additional control modes, each control mode of the stack comprising a plurality of control signal candidate values; identifying an intersection of one or more control signal candidate values from the plurality of control signal candidate values of each control mode of the stack according to the prioritization order; and determining, based on the prioritization order, at least one time-varying charge/discharge control signal for the electrical energy storage device from the intersection of control signal candidate values.","['H', 'Y']","['H02', 'Y02', 'Y04', 'Y10']","['H02J', 'H02M', 'Y02E', 'Y02P', 'Y04S', 'Y10S']",2,4,6,186,0
3,US11973345B2,Building energy system with predictive control of battery and green energy resources ,Johnson Controls Tyco IP Holdings LLP,"['Robert D. Turney', ' Nishith R. Patel']",2017-04-27,2023-06-02,2024-04-30,2024-04-30,https://patents.google.com/patent/US11973345B2/en,https://patentimages.storage.googleapis.com/0f/58/d5/b7dcb88571544b/US11973345-20240430-D00000.png,US,B2,A predictive controller for a building energy system includes one or more processing circuits configured to obtain a constraint that defines a total electric load to be served by the building energy system at each time step of a time period as a summation of multiple source-specific energy components. The source-specific energy components include a first energy component indicating a first amount of energy to obtain from a first energy source during the time step and a second energy component indicating a second amount of energy to obtain from a second energy source during the time step. The one or more processing circuits are configured to perform a predictive control process subject to the constraint to determine values of the source-specific energy components at each time step of the time period and operate equipment of the building energy system using the values of the source-specific energy components.,"['F', 'H', 'Y']","['F25', 'F24', 'H02', 'Y02']","['F25B', 'F24F', 'H02S', 'Y02E']",3,4,4,333,0
4,US11780305B2,Tonneau system for use with a pickup truck ,Worksport Ltd.,"['Steven Rossi', ' Jonathan Loudon']",2015-10-30,2023-01-10,2023-10-10,2023-10-10,https://patents.google.com/patent/US11780305B2/en,https://patentimages.storage.googleapis.com/36/65/cf/91e27dd2debca8/US11780305-20231010-D00000.png,US,B2,"A tonneau system for use with a pickup truck. The tonneau system includes a frame and a tonneau cover having a plurality of tonneau sections moveable between a folded position and an unfolded position. The tonneau cover includes solar energy-receiving material secured to a top exposed surface of at least two of the tonneau sections. The solar energy-receiving material moves with their corresponding tonneau sections between the unfolded and folded positions. A battery, transformer, and/or electrical cabling system may be included within the circuit for power storage and conversion.","['F', 'Y']","['F03', 'F01', 'F02', 'F22', 'F05', 'Y02']","['F03G', 'F01K', 'F02C', 'F22B', 'F05D', 'Y02E']",2,6,6,273,0
5,US11855250B2,Systems and methods for series battery charging ,"24M Technologies, Inc.","['Tony L. Taylor', ' Naoki Ota', ' Taison Tan']",2014-10-13,2023-01-03,2023-12-26,2023-12-26,https://patents.google.com/patent/US11855250B2/en,https://patentimages.storage.googleapis.com/7f/9f/fa/bf8d521ef6290c/US11855250-20231226-D00000.png,US,B2,"Systems and methods for charging and discharging a plurality of batteries are described herein. In some embodiments, a system includes a battery module, an energy storage system electrically coupled to the battery module, a power source, and a controller. The energy storage system is operable in a first operating state in which energy is transferred from the energy storage system to the battery module to charge the battery module, and a second operating state in which energy is transferred from the battery module to the energy storage system to discharge the battery module. The power source electrically coupled to the energy storage system and is configured to transfer energy from the power source to the energy storage system based on an amount of stored energy in the energy storage system. The controller is operably coupled to the battery module and is configured to monitor and control a charging state of the battery module.","['H', 'Y']","['H02', 'Y02']","['H02J', 'H02M', 'Y02E']",2,2,3,357,0
6,US11774996B2,"System, method, and apparatus for electric power grid and network management of grid elements ","Causam Enterprises, Inc.","['Joseph W. Forbes', ' Jr.']",2012-07-31,2023-01-18,2023-10-03,2023-10-03,https://patents.google.com/patent/US11774996B2/en,https://patentimages.storage.googleapis.com/01/a0/71/5a5fe4f614df91/US11774996-20231003-D00000.png,US,B2,"Systems, methods, and apparatus for smart electric power grid communication are disclosed in the present invention. At least one grid element is constructed and configured in network-based communication with a server via at least one coordinator. The at least one grid element is transformed into at least one active grid element automatically and/or autonomously after initial connection with the server. The at least one active grid element sends and receives messages to and from the server via at least one coordinator. The at least one coordinator matches and prioritizes the at least one active grid element. The at least one coordinator provides a priority flag on the messages. The at least one coordinator tracks an actual amount of power introduced to and available for an electric power grid or a curtailment power available from the at least one active grid element.","['F', 'Y']","['F01', 'F03', 'F22', 'Y02']","['F01K', 'F03G', 'F22B', 'Y02E']",2,4,4,258,0
7,US11947234B2,Solar power dynamic glass for heating and cooling buildings ,"View, Inc.","['Brandon Tinianov', ' Dhairya Shrivastava', ' Stephen Clark Brown', ' Erich Robert Klawuhn']",2017-02-16,2023-04-06,2024-04-02,2024-04-02,https://patents.google.com/patent/US11947234B2/en,https://patentimages.storage.googleapis.com/a4/e8/79/1f0e0e9a22c349/US11947234-20240402-D00000.png,US,B2,"Various embodiments herein relate to systems for powering electrochromic windows in a building. Systems may include photovoltaic panels configured to generate electrical power, energy storage device(s) configured for storing generated power, and one or more controllers on a network of electrochromic windows that are configured to receive power from the energy storage device(s) and power tint transitions in one or more electrochromic windows. Systems may include various additional circuit components described herein for regulating and/or controlling the generation, storage, and application of electric power. The systems and techniques described herein can be used to design networks of electrochromic windows that are hybrid-solar or off-the-grid (âOTGâ).","['G', 'H', 'Y']","['G05', 'H02', 'Y02']","['G05F', 'H02J', 'Y02E']",3,3,3,362,1
8,US11962268B2,Frameless solar module mounting ,Nextracker Llc,['Alexander W. Au'],2015-06-09,2023-05-11,2024-04-16,2024-04-16,https://patents.google.com/patent/US11962268B2/en,https://patentimages.storage.googleapis.com/c9/48/40/697b5a31c77e84/US11962268-20240416-D00000.png,US,B2,"In an example, a clamp assembly for a glass on glass solar module for a tracker is included. The assembly has a lower clamp structure characterized by a top-hat shaped rail structure having a length extending from a first end to a second end. In an example, the assembly has an upper clamp structure configured to sandwich a pair of edges of a pair of solar modules with a portion of the lower clamp structure. In an example, the assembly has a locking spacer configured to the pair of edges of the pair of solar modules. In an example, the pair of edges comprises substantially glass material. In an example, the assembly has a pair of key structures configured with the locking spacer. Each of the key structures is affixed to each of the solar modules to physically lock each of the solar modules to the upper clamp structure.","['F', 'H', 'Y']","['F03', 'H02', 'F05', 'Y02']","['F03D', 'H02K', 'H02S', 'F05B', 'Y02B', 'Y02E']",3,4,6,341,0
9,US11968763B2,Solar lamps with radial elements ,"Luminaid Lab, Llc","['Andrea M. Sreshta', ' Anna Ruth Stork']",2016-11-04,2023-08-30,2024-04-23,2024-04-23,https://patents.google.com/patent/US11968763B2/en,https://patentimages.storage.googleapis.com/83/ec/65/fdc350b057bdcf/US11968763-20240423-D00000.png,US,B2,"A solar-powered lamp is disclosed. The lamp includes a plurality of radiating extensions, each being formed from a plurality of flat panels that can fold relative to each other along lines between respective ones of the plurality of flat panels; and an electronics assembly, wherein the lamp is collapsible, and the flat panels for each of the radiating extensions fold relative to each other as the lamp is collapsed.","['F', 'H', 'Y']","['F01', 'F02', 'H02', 'F05', 'Y02']","['F01K', 'F02C', 'H02J', 'F05D', 'Y02E', 'Y02P', 'Y02T']",3,5,7,237,0
10,US11962941B2,Wireless network camera systems ,Axis Ab,"['Jon Siann', ' Dennis James Espey']",2006-11-20,2023-02-15,2024-04-16,2024-04-16,https://patents.google.com/patent/US11962941B2/en,https://patentimages.storage.googleapis.com/e4/41/56/6c2ccff89357f2/US11962941-20240416-D00000.png,US,B2,"Apparatus, systems and techniques are provided associated with a battery powered wireless camera, which includes an internal battery and an image capture module to capture images. Further, the battery powered wireless camera may include a first communication module and a second communication module configured for wireless communication. If the second communication module is powered down, the image capture module may store captured infrared images. If activation is triggered, the second communication module may power up and wirelessly transmit the captured images. In an example, the wireless camera may further include an infrared detection module configured for capturing infrared images. Further, the activation may include any one of a noise, a motion, a timing, a command, and an infrared detection. Also, the first communication module may wirelessly communicate utilizing a first communication mode and the second communication module may wirelessly communicate utilizing a second communication mode.","['G', 'H', 'Y']","['G05', 'G06', 'H02', 'Y02']","['G05B', 'G05F', 'G06N', 'H02J', 'H02M', 'G06F', 'Y02E']",3,4,7,426,1
11,US11733221B2,Apparatus and methods for reducing fugitive gas emissions at oil facilities ,"Project Canary, Pbc",['David L. Armitage'],2019-01-23,2023-01-17,2023-08-22,2023-08-22,https://patents.google.com/patent/US11733221B2/en,https://patentimages.storage.googleapis.com/35/10/88/ca9093de84cdff/US11733221-20230822-D00000.png,US,B2,Apparatus and methods for detecting and reporting pollution at an oil facility are disclosed. The technology utilizes a logic control system to read from a pollution sensor and present the sensed data as a pollutant from a leak. The pollution leakage can be further managed and reduced.,"['F', 'H', 'Y']","['F01', 'F03', 'F24', 'F28', 'H01', 'Y02']","['F01K', 'F03G', 'F24T', 'F28D', 'F28F', 'H01M', 'Y02E']",3,6,7,217,0
12,US11782471B2,"System, method, and data packets for messaging for electric power grid elements over a secure internet protocol network ","Causam Enterprises, Inc.","['Joseph W. Forbes', ' Jr.']",2012-07-31,2023-01-18,2023-10-10,2023-10-10,https://patents.google.com/patent/US11782471B2/en,https://patentimages.storage.googleapis.com/fa/ac/01/34c61e08c33f10/US11782471-20231010-D00000.png,US,B2,"Systems, methods and apparatus for electric power grid management and communications are disclosed. At least one active grid element is constructed and configured in network-based communication with a server via at least one coordinator. The at least one active grid element communicates Internet Protocol (IP)-based messages with the server via the at least one coordinator in real time or less than 15 minutes interval. The at least one active grid element participates actively in an electric power grid. The at least one active grid element has an energy consumption pattern or an energy supply pattern. The IP-based messages comprise at least one IP packet including a content, a priority, a security, and a transport route. The content comprises an amount of power available for the electric power grid or an amount of curtailment power available at an attachment point of the at least one grid element.","['B', 'H', 'Y']","['B60', 'H02', 'Y02', 'Y04']","['B60L', 'H02J', 'H02M', 'B60K', 'Y02B', 'Y02E', 'Y02T', 'Y04S']",3,4,8,265,0
13,US12009449B2,Solar cell having an emitter region with wide bandgap semiconductor material ,Maxeon Solar Pte. Ltd.,"['Richard M. Swanson', ' Marius M. Bunea', ' Michael C. Johnson', ' David D. Smith', ' Yu-Chen Shen', ' Peter J. Cousins', ' Tim Dennis']",2012-03-23,2023-02-09,2024-06-11,2024-06-11,https://patents.google.com/patent/US12009449B2/en,https://patentimages.storage.googleapis.com/96/ef/80/f09cc905b789f0/US12009449-20240611-D00000.png,US,B2,"Solar cells having emitter regions composed of wide bandgap semiconductor material are described. In an example, a method includes forming, in a process tool having a controlled atmosphere, a thin dielectric layer on a surface of a semiconductor substrate of the solar cell. The semiconductor substrate has a bandgap. Without removing the semiconductor substrate from the controlled atmosphere of the process tool, a semiconductor layer is formed on the thin dielectric layer. The semiconductor layer has a bandgap at least approximately 0.2 electron Volts (eV) above the bandgap of the semiconductor substrate.","['H', 'Y']","['H02', 'Y02']","['H02J', 'H02M', 'Y02E']",2,2,3,488,0
14,US11854033B2,Farm ecosystem ,Bao Tran,['Bao Tran'],2019-05-13,2023-03-01,2023-12-26,2023-12-26,https://patents.google.com/patent/US11854033B2/en,https://patentimages.storage.googleapis.com/dc/e2/46/ebaa89e97071fe/US11854033-20231226-D00000.png,US,B2,"An agricultural method includes providing a positive air pressure chamber to prevent outside contaminants from entering the chamber; growing crops in a plurality of cells in the chamber, each cell having multi-grow benches or levels, each cell further having connectors to vertical hoists for vertical movements in the chamber; maintaining pre-set temperature, humidity, carbon dioxide, watering and lighting levels to achieve predetermined plant growth; using motorized transport rails to deliver benches for operations including seeding, harvesting, grow media recovery, and bench wash; dispensing seeds in the cell with a mechanical seeder coupled to the transport rails; growing the crops with computer controlled nutrients, light and air level; and harvesting the crops and delivering the harvested crop at a selected outlet of the chamber.","['H', 'Y']","['H01', 'H02', 'Y02']","['H01L', 'H02J', 'H02S', 'H02M', 'Y02E']",2,3,5,300,0
15,US11967922B2,"Optimized truss foundations, adapters for optimized truss foundations, and related systems and methods ","Ojjo, Inc.","['Jack West', ' David Mar', ' Charles Almy', ' Tyrus Hudson', ' Johann Karkheck', ' Kathryn Pesce']",2018-09-05,2023-02-08,2024-04-23,2024-04-23,https://patents.google.com/patent/US11967922B2/en,https://patentimages.storage.googleapis.com/4f/ae/02/c57089269995fc/US11967922-20240423-D00000.png,US,B2,"A universal adapter for enabling truss foundations to support conventional single-axis trackers. In some cases, the adapter has a main body with an upper portion that presents a standard I-beam interface with pre-drilled holes to interface to a specific single-axis tracker. A pair of connecting portions point down and away from the main body and enable upper leg sections to connect the adapter to a pair of driven screw anchors located below it. The connecting portions may orient the truss so that the rotational axis of the single-axis tracker is aligned with the work point of the truss foundation made from the adapter, upper legs, and driven screw anchors. This will enable to the truss to interface with many different trackers much like conventional plumb-driven H-pile foundations.","['H', 'Y']","['H02', 'Y02']","['H02M', 'H02J', 'H02S', 'Y02B', 'Y02E']",2,2,5,440,0
16,US12000207B2,Light-modulating electrophoretic device ,E Ink Corporation,"[""Donal Martin O'Keeffe""]",2013-10-22,2023-05-31,2024-06-04,2024-06-04,https://patents.google.com/patent/US12000207B2/en,https://patentimages.storage.googleapis.com/08/ac/5e/18c70ebac8359c/US12000207-20240604-D00000.png,US,B2,"A variable light transmittance sheet comprises a first transparent electrode and a second transparent electrode spaced apart from the first electrode, and between the electrodes an electrophoretic cell containing an electrophoretic ink and one or more non-planar solid polymer elements. In an embodiment, the electrophoretic ink includes charged particles in a suspending fluid, and 75% or more by mass of the suspending fluid is an organosilicone or an aliphatic hydrocarbon and the solid polymer is a fluorinated elastomeric polymer.","['B', 'C', 'F', 'H', 'Y']","['F01', 'F28', 'B01', 'B63', 'C25', 'F03', 'F22', 'H01', 'H02', 'Y02']","['F01K', 'F28D', 'B01D', 'B63H', 'C25B', 'F03G', 'F22B', 'H01M', 'H02J', 'H02M', 'F03D', 'Y02E', 'Y02P', 'Y02T']",5,10,14,370,0
17,US11844569B1,Methods and devices for endovascular ablation of a splanchnic nerve ,"Axon Therapies, Inc.","['Dorin Panescu', ' Andrew Wu', ' Zoar Jacob ENGELMAN', ' Mark Gelfand', ' Mark S. Leung']",2018-01-26,2023-08-15,2023-12-19,2023-12-19,https://patents.google.com/patent/US11844569B1/en,https://patentimages.storage.googleapis.com/61/42/da/25fada9b3738ae/US11844569-20231219-D00000.png,US,B1,"Systems, devices, and methods for transvascular ablation of target tissue are disclosed herein. The devices and methods may, in some examples, be used for splanchnic nerve ablation to increase splanchnic venous blood capacitance to treat at least one of heart failure and hypertension. For example, the devices disclosed herein may be advanced endovascularly to a target vessel in the region of a thoracic splanchnic nerve (TSN), such as a greater splanchnic nerve (GSN) or a TSN nerve root. Also disclosed are method of treating heart failure, such as HFpEF, by endovascularly ablating a thoracic splanchnic nerve to increase venous capacitance and reduce pulmonary blood pressure.","['F', 'H', 'Y']","['F01', 'F02', 'F05', 'H02', 'Y02']","['F01D', 'F02C', 'F05D', 'H02J', 'Y02E']",3,5,5,126,0
18,US11865941B2,Battery management system ,"Resc, Ltd.",['Daisuke Suzuki'],2018-06-29,2023-05-18,2024-01-09,2024-01-09,https://patents.google.com/patent/US11865941B2/en,https://patentimages.storage.googleapis.com/69/de/00/53c9e4a0496f04/US11865941-20240109-D00000.png,US,B2,"Provided is a battery management system of an electric vehicle suitable for a sharing service. A battery management system 100 includes: an electric vehicle 2 capable of travelling by driving a motor with an exchangeable battery 1; a battery station 3 capable of charging the battery 1 by adjusting a charging speed; and a management server 4 connected to the electric vehicle 2 and the battery station 3 through a communication network. The management server 4 quantitatively evaluates exchangeability of the battery 1 stored in the battery station 3, on the basis of at least a position of the electric vehicle 2 and a battery remaining amount of the battery 1 mounted on the electric vehicle 2, determines the charging speed of the battery 1 of the battery station 3, on the basis of an evaluation value of the exchangeability of the battery 1, and transmits control information relevant to the determined charging speed, to the battery station 3.","['H', 'Y']","['H01', 'H02', 'Y02']","['H01L', 'H02S', 'Y02B', 'Y02E']",2,3,4,236,0
19,US11990172B2,Refresh command control for host assist of row hammer mitigation ,Intel Corporation,"['Bill Nale', ' Christopher E. Cox']",2019-03-29,2023-06-22,2024-05-21,2024-05-21,https://patents.google.com/patent/US11990172B2/en,https://patentimages.storage.googleapis.com/52/f4/a7/12e607311cbdb0/US11990172-20240521-D00000.png,US,B2,"A memory device with internal row hammer mitigation couples to a memory controller. The memory controller or host can assist with row hammer mitigation by sending additional refresh cycles or refresh commands. In response to an extra refresh command the memory device can perform refresh for row hammer mitigation instead of refresh for standard data integrity. The memory controller can keep track of the number of activate commands sent to the memory device, and in response to a threshold number of activate commands, the memory controller sends the additional refresh command. With the extra refresh command the memory device can refresh the potential victim rows of a potential aggressor row, instead of simply refreshing a row that has not been accessed for a period of time.","['G', 'H']","['H02', 'G05', 'G06']","['H02J', 'G05B', 'G06F']",2,3,3,334,0
