,id,title,assignee,inventor,priority_date,filing_date,publication_date,grant_date,result_link,representative_figure_link,country,kind_code,abstract,cpc_1,cpc_2,cpc_3,cpc_1_num,cpc_2_num,cpc_3_num,file_grant_days,cpc_1_GHY
165,US11844152B2,Detachable power source for an aerosol delivery device ,"Rai Strategic Holdings, Inc.","['Michael F. Davis', ' Percy D. Phillips', ' James W. Rogers', ' Lisa E. Brown', ' James Demopoulos']",2016-04-12,2023-01-26,2023-12-12,2023-12-12,https://patents.google.com/patent/US11844152B2/en,https://patentimages.storage.googleapis.com/ef/8c/41/91637ca8629c80/US11844152-20231212-D00000.png,US,B2,An aerosol delivery device having a detachable power source is provided. A control body may be coupleable with a cartridge to form an aerosol delivery device. The cartridge may contain an aerosol precursor composition and be equipped with a heating element configured to activate and vaporize components of the aerosol precursor composition. The control body may comprise a housing and a power source detachably coupled to an outer surface of the housing. A control component may be contained within the housing and configured to operate in an active mode in which the control body is coupled with the cartridge. The control component in the active mode may be configured to direct power from the power source to the heating element to activate and vaporize components of the aerosol precursor composition.,['H'],['H02'],['H02J'],1,1,1,320,0
166,US11985310B2,Temporal motion data candidate derivation in video coding ,Texas Instruments Incorporated,['Minhua Zhou'],2011-04-18,2023-02-19,2024-05-14,2024-05-14,https://patents.google.com/patent/US11985310B2/en,https://patentimages.storage.googleapis.com/e0/18/57/d69fc7550fb5d4/US11985310-20240514-D00000.png,US,B2,"A method for derivation of a temporal motion data (TMD) candidate for a prediction unit (PU) in video encoding or video decoding is provided. The derived TMD candidate is for inclusion in an inter-prediction candidate list for the PU. The method includes determining a primary TMD position relative to a co-located PU in a co-located largest coding unit (LCU), wherein the co-located PU is a block in a reference picture having a same size, shape, and coordinates as the PU, and selecting at least some motion data of a secondary TMD position as the TMD candidate when the primary TMD position is in a bottom neighboring LCU or in a bottom right neighboring LCU of the co-located LCU, wherein the secondary TMD position is determined relative to the co-located PU.","['F', 'G', 'Y']","['F01', 'F02', 'F22', 'G21', 'F05', 'Y02']","['F01K', 'F02C', 'F22B', 'F22D', 'F22G', 'G21C', 'G21D', 'F05D', 'Y02E']",3,6,9,450,0
167,US11893592B2,Incentivized neural network training and assurance processes ,Revealit Corporation,"['Garry Anthony Smith', ' Zachary Oakes', ' Steven Dennis Flinn']",2019-09-23,2023-01-20,2024-02-06,2024-02-06,https://patents.google.com/patent/US11893592B2/en,https://patentimages.storage.googleapis.com/3e/53/d4/a7e12c6318f371/US11893592-20240206-D00000.png,US,B2,A method and system for incentivized neural network training and assurance processes provides incentives to object miners to identify objects in video streams for the purposes of enhancing the training of computer-implemented neural networks on the identified objects and/or augmenting the results of automatic object identification by trained neural networks. An object mining user interface and process is provided to object miners that provides incentives for identifying objects in video streams and technical capabilities for designating identified objects within multiple multi-dimensional regions of pixels. Incentives may be token-based and in accordance with end user interactions within a visual user interface with representations of the miner-identified objects within a video stream.,"['G', 'H', 'Y']","['H02', 'G05', 'Y02', 'Y04']","['H02J', 'G05B', 'Y02E', 'Y04S']",3,4,4,382,1
168,US11941307B2,"Methods, apparatuses, and systems captures image of pre-printed print media information for generating validation image by comparing post-printed image with pre-printed image and improving print quality ","Hand Held Products, Inc.","['Jose Fernando Sanchez Gutierrez', ' Ronald Schwallie', ' Thomas Axel Jonas Celinder', ' H Sprague Ackley']",2018-01-05,2023-02-23,2024-03-26,2024-03-26,https://patents.google.com/patent/US11941307B2/en,https://patentimages.storage.googleapis.com/3d/a9/b8/35bb58313dc7bc/US11941307-20240326-D00000.png,US,B2,"A method for evaluating a print quality of a printed document that is printed by a printer is provided. The printer comprises a pre-print image scanner, a post-print image scanner, and a printhead disposed between the pre-print image scanner and the post-print image scanner. The method comprises generating a pre-printing image of a print media, generating the printed document, generating a post-printing image of the printed document, generating a validation image by comparing the post-printing image with the pre-printing image, and comparing the validation image with the source image.","['C', 'Y']","['C12', 'Y02']","['C12P', 'C12N', 'C12Y', 'Y02E']",2,2,4,397,0
169,US11888291B2,Rigid high power and high speed lasing grid structures ,"Optipulse, Inc.",['John Richard Joseph'],2015-07-30,2023-01-12,2024-01-30,2024-01-30,https://patents.google.com/patent/US11888291B2/en,https://patentimages.storage.googleapis.com/84/c5/9c/464a3a9c1f033f/US11888291-20240130-D00000.png,US,B2,"Disclosed herein are various embodiments for stronger and more powerful high speed laser arrays. For example, an apparatus is disclosed that comprises an active mesa structure in combination with an electrical waveguide, wherein the active mesa structure comprises a plurality of laser regions within the active mesa structure itself, each laser region of the active mesa structure being electrically isolated within the active mesa structure itself relative to the other laser regions of the active mesa structure.","['H', 'Y']","['H02', 'Y02']","['H02M', 'H02J', 'Y02B', 'Y02E']",2,2,4,383,0
170,US12010136B2,Dynamic message analysis platform for enhanced enterprise security ,"Proofpoint, Inc.",['J Trent Adams'],2019-12-12,2023-06-23,2024-06-11,2024-06-11,https://patents.google.com/patent/US12010136B2/en,https://patentimages.storage.googleapis.com/03/bc/af/f0bd5d845bf69e/US12010136-20240611-D00000.png,US,B2,"Aspects of the disclosure relate to dynamic message analysis using machine learning. Using one or more automated methods, a computing platform may identify relationships between message sender domains and message recipient domains. After identifying the relationships, the computing platform may apply a security scoring process to a message sender domain to compute a weighted security score for the message sender domain. The computing platform may determine a weighted grade for the message sender domain based on the weighted security score for the message sender domain. Based on the weighted grade for the message sender domain, the computing platform may execute one or more enhanced protection actions associated with the message sender domain.","['F', 'H', 'Y']","['F01', 'F02', 'H01', 'H02', 'Y02', 'Y04']","['F01D', 'F02C', 'H01M', 'H02J', 'Y02B', 'Y02E', 'Y04S']",3,6,7,354,0
171,US11959062B2,Distributed systems for the efficient production and use of microbe-based compositions ,"Locus Solutions Ipco, Llc","['Sean Farmer', ' Paul S. Zorner', ' Ken Alibek', ' Kent Adams', ' Tyler Dixon']",2016-09-08,2023-08-10,2024-04-16,2024-04-16,https://patents.google.com/patent/US11959062B2/en,https://patentimages.storage.googleapis.com/9a/89/de/ec6685b4083af0/US11959062-20240416-D00001.png,US,B2,"The invention relates to systems and methods for effective production and use of microorganisms and/or the fermentation broth in which they are produced. Advantageously, the system is cost-effective, scalable, quick, versatile, efficacious, and helpful in reducing resistance to chemical compounds and residue that concerns consumers.","['F', 'G', 'H', 'Y']","['G02', 'F24', 'H01', 'H02', 'Y02']","['G02B', 'F24S', 'H01L', 'H02S', 'Y02E']",4,5,5,250,1
172,US11993124B2,Side-by-side vehicle ,Polaris Industries Inc.,"['Aaron D. Deckard', ' Adam J. Schlangen', ' Dennis J. LUTZ', ' Alex R. Scheuerell', ' Aaron J. Nysse']",2013-09-04,2023-01-18,2024-05-28,2024-05-28,https://patents.google.com/patent/US11993124B2/en,https://patentimages.storage.googleapis.com/b9/bc/ce/79aacbd4c729fe/US11993124-20240528-D00000.png,US,B2,"A utility vehicle includes a plurality of ground-engaging members, a frame assembly, a cab frame assembly, a front suspension assembly, a rear suspension assembly, a power steering assembly, and a powertrain assembly, all of which may be configured to lower the center of gravity of the vehicle.","['H', 'Y']","['H02', 'Y02']","['H02S', 'Y02B', 'Y02E']",2,2,3,496,0
173,US11918655B2,Intranasal epinephrine formulations and methods for the treatment of disease ,"Aegis Therapeutics, Llc","['Richard Lowenthal', ' Edward T. Maggio', ' Robert G. Bell', ' Pratik Shah']",2018-12-21,2023-06-07,2024-03-05,2024-03-05,https://patents.google.com/patent/US11918655B2/en,https://patentimages.storage.googleapis.com/db/03/56/fba42a0966962f/US11918655-20240305-D00001.png,US,B2,Drug products adapted for nasal delivery comprising formulations with epinephrine and devices comprising such formulations are provided. Methods of treating anaphylaxis with epinephrine products are also provided.,"['B', 'Y']","['B60', 'Y02', 'Y10']","['B60K', 'B60Y', 'Y02T', 'Y10S']",2,3,4,272,0
174,US11978016B2,Selective usage of product models ,Trax Technology Solutions Pte Ltd.,"['Yair ADATO', ' Aviv Eisenschtat']",2018-01-10,2023-06-21,2024-05-07,2024-05-07,https://patents.google.com/patent/US11978016B2/en,https://patentimages.storage.googleapis.com/cf/c7/c3/49d9497317e0e3/US11978016-20240507-D00000.png,US,B2,"A system for identifying products in a retail store is provided. The system may include a processor configured to: receive an image depicting a store shelf and a product displayed thereon; select a product model subset based on a characteristic of the store shelf determined based on analysis of the image; determine whether the product model subset is applicable to the product; and when the product model subset is applicable to the product, analyze a representation of the product depicted in the image using the product model subset, and identify the product based on the analysis of the representation of the product.","['H', 'Y']","['H01', 'Y02']","['H01L', 'Y02E', 'Y02P']",2,2,3,321,0
175,US11863921B2,Application performance monitoring and management platform with anomalous flowlet resolution ,"Cisco Technology, Inc.","['Ashutosh Kulshreshtha', ' Omid Madani', ' Vimal Jeyakumar', ' Navindra Yadav', ' Ali Parandehgheibi', ' Andy Sloane', ' Kai Chang', ' Khawar Deen', ' Shih-Chun Chang', ' Hai Vu']",2017-03-28,2023-05-05,2024-01-02,2024-01-02,https://patents.google.com/patent/US11863921B2/en,https://patentimages.storage.googleapis.com/ab/2a/8c/bf39a62108c99f/US11863921-20240102-D00000.png,US,B2,"An application and network analytics platform can capture telemetry from servers and network devices operating within a network. The application and network analytics platform can determine an application dependency map (ADM) for an application executing in the network. Using the ADM, the application and network analytics platform can resolve flows into flowlets of various granularities, and determine baseline metrics for the flowlets. The baseline metrics can include transmission times, processing times, and/or data sizes for the flowlets. The application and network analytics platform can compare new flowlets against the baselines to assess availability, load, latency, and other performance metrics for the application. In some implementations, the application and network analytics platform can automate remediation of unavailability, load, latency, and other application performance issues.","['H', 'Y']","['H02', 'Y02', 'Y04']","['H02J', 'H02M', 'Y02E', 'Y04S']",2,3,4,242,0
176,US12008174B2,"Systems, methods, and apparatus for enhanced peripherals ",Science House LLC,"['James Jorasch', ' Christopher Capobianco', ' Isaac W. Hock', ' Michael Werner', ' Geoffrey Gelman', ' Gennaro Rendino']",2020-04-29,2023-09-14,2024-06-11,2024-06-11,https://patents.google.com/patent/US12008174B2/en,https://patentimages.storage.googleapis.com/03/aa/8b/3ed9a972fc6179/US12008174-20240611-D00000.png,US,B2,"In accordance with some embodiments, systems, apparatus, interfaces, methods, and articles of manufacture are provided for creating shared experiences using peripheral devices. In various embodiments, data is captured about a first user's peripheral usage and environment. A determination is made based on the data as to the first user's current experience. Aspects of the first user's experience are then recreated for a second user. In various embodiments, the experience is shared with the second user via peripherals and output devices.","['H', 'Y']","['H02', 'Y02']","['H02J', 'H02M', 'Y02E']",2,2,3,271,0
177,US11960095B2,See-through computer display systems ,"Mentor Acquisition One, Llc",['John D. Haddick'],2017-07-24,2023-04-19,2024-04-16,2024-04-16,https://patents.google.com/patent/US11960095B2/en,https://patentimages.storage.googleapis.com/68/98/2b/db9d9e53314a5f/US11960095-20240416-D00000.png,US,B2,Aspects of the present invention relate to methods and systems for the see-through computer display systems with integrated IR eye imaging technologies.,"['B', 'F', 'Y']","['F24', 'B01', 'F22', 'F23', 'F28', 'Y02']","['F24D', 'B01D', 'F22D', 'F23J', 'F28F', 'Y02B', 'Y02E']",3,6,7,363,0
178,US11887265B2,Content presentation in head worn computing ,"Mentor Acquisition One, Llc","['Ralph F. Osterhout', ' John D. Haddick', ' Robert Michael Lohse', ' John N. Border', ' Nima L. Shams']",2014-06-09,2023-03-23,2024-01-30,2024-01-30,https://patents.google.com/patent/US11887265B2/en,https://patentimages.storage.googleapis.com/04/30/b4/ba0e4b630c4544/US11887265-20240130-D00000.png,US,B2,"Methods and systems for presenting digital content on a see-through display are disclosed. In some embodiments, the digital content is presented based on a display attribute associated with personal information related to a user of a wearable head device comprising the see-through display. In some embodiments, the digital content is associated with a geo-spatial location of a physical structure, and presenting the digital content on the see-through display comprises indicating a spatial relationship between the digital content and the physical structure.","['G', 'H', 'Y']","['H02', 'G05', 'Y02']","['H02M', 'G05F', 'H02J', 'Y02E']",3,3,4,313,1
179,US11969024B2,Heated aerosol-generating device and method for generating aerosol with consistent properties ,Philip Morris Products S.A.,['Arkadiusz Kuczaj'],2012-12-28,2023-04-17,2024-04-30,2024-04-30,https://patents.google.com/patent/US11969024B2/en,https://patentimages.storage.googleapis.com/c1/08/8c/a998656bf69267/US11969024-20240430-D00000.png,US,B2,"A method of controlling aerosol production in an aerosol-generating device is provided, the device including: a heater including a heating element to heat an aerosol-forming substrate, and a power source to provide power to the element, the method including: providing power to the element; and controlling the power provided such that in a first phase, the power is provided to the element such that a temperature of the element increases from an initial temperature to a first target temperature, in a second phase, the power is provided such that the temperature reduces to a second target temperature lower than the first temperature, and in a third phase, the power is provided such that the temperature increases to a third temperature, the first phase being ended in response to the element reaching the first target temperature or at a predetermined time following the element reaching the first target temperature.","['H', 'Y']","['H02', 'Y02']","['H02M', 'H02J', 'Y02B', 'Y02E']",2,2,4,379,0
180,US11956025B2,"Systems, methods, and devices for automatic signal detection based on power distribution by frequency over time within an electromagnetic spectrum ","Digital Global Systems, Inc.","['David William Kleinbeck', ' Ronald C. Dzierwa']",2017-01-23,2023-09-14,2024-04-09,2024-04-09,https://patents.google.com/patent/US11956025B2/en,https://patentimages.storage.googleapis.com/c9/8e/bb/32f2f18ba22f85/US11956025-20240409-D00000.png,US,B2,"Systems, methods, and apparatus for automatic signal detection in a radio-frequency (RF) environment are disclosed. At least one node device is in a fixed nodal network. The at least one node device is operable to measure and learn the RF environment in a predetermined period based on statistical learning techniques, thereby creating learning data. The at least one node device is operable to create a spectrum map based on the learning data. The at least one node device is operable to calculate a power distribution by frequency of the RF environment in real time or near real time, including a first derivative and a second derivative of fast Fourier transform (FFT) data of the RF environment. The at least one node device is operable to identify at least one signal based on the first derivative and the second derivative of FFT data.","['H', 'Y']","['H02', 'Y02']","['H02M', 'Y02E']",2,2,2,208,0
181,US12002115B2,Digital modeling and tracking of agricultural fields for implementing agricultural field trials ,Climate Llc,"['Jason Kendrick Bull', ' Nicholas Charles Cizek', ' Brandon Rinkenberger', ' Thomas Gene Ruff', ' Doug Sauder']",2017-08-21,2023-02-20,2024-06-04,2024-06-04,https://patents.google.com/patent/US12002115B2/en,https://patentimages.storage.googleapis.com/bf/c2/47/1c62f07efeda6d/US12002115-20240604-D00000.png,US,B2,"A system for implementing a trial in one or more fields is provided. In an embodiment, a agricultural intelligence computing system receives field data for a plurality of agricultural fields. Based, at least in part, on the field data for the plurality of agricultural fields, the agricultural intelligence computing system identifies one or more target agricultural fields. The agricultural intelligence computing system sends, to a field manager computing device associated with the one or more target agricultural fields, a trial participation request. The server receives data indicating acceptance of the trial participation request from the field manager computing device. The server determines one or more locations on the one or more target agricultural fields for implementing a trial and sends data identifying the one or more locations to the field manager computing device.","['G', 'H', 'Y']","['H01', 'H02', 'G05', 'Y02']","['H01L', 'H02J', 'H02M', 'G05F', 'H02S', 'Y02E']",3,4,6,470,1
182,US11838607B2,Electric shaver with imaging capability ,May Patents Ltd.,['Yehuda Binder'],2008-12-30,2023-01-02,2023-12-05,2023-12-05,https://patents.google.com/patent/US11838607B2/en,https://patentimages.storage.googleapis.com/0b/16/5a/4373b554c26ed8/US11838607-20231205-D00000.png,US,B2,"System and method for improving the shaving experience by providing improved visibility of the skin shaving area. A digital camera is integrated with the electric shaver for close image capturing of shaving area, and displaying it on a display unit. The display unit can be integral part of the electric shaver casing, or housed in a separated device which receives the image via a communication channel. The communication channel can be wireless (using radio, audio or light) or wired, such as dedicated cabling or using powerline communication. A light source is used to better illuminate the shaving area. Video compression and digital image processing techniques are used for providing for improved shaving results. The wired communication medium can simultaneously be used also for carrying power from the electric shaver assembly to the display unit, or from the display unit to the electric shaver.","['G', 'H', 'Y']","['G01', 'H02', 'G05', 'G06', 'G08', 'Y02', 'Y04']","['G01D', 'H02J', 'G01R', 'G05B', 'G06Q', 'G08C', 'H02S', 'Y02B', 'Y02E', 'Y02P', 'Y02T', 'Y04S']",3,7,12,337,1
183,US11926780B2,Shaped abrasive particles and method of forming same ,"Saint-Gobain Ceramics & Plastics, Inc.","['Frederic JOSSEAUX', ' David F. Louapre']",2014-12-23,2023-02-14,2024-03-12,2024-03-12,https://patents.google.com/patent/US11926780B2/en,https://patentimages.storage.googleapis.com/f3/4b/4f/3c42eedafdf06d/US11926780-20240312-D00000.png,US,B2,An abrasive particle including a shaped abrasive particle including a body having a plurality of abrasive particles bonded to at least one surface of the body of the shaped abrasive particle.,"['G', 'H', 'Y']","['G05', 'H02', 'Y02']","['G05F', 'H02J', 'H02M', 'Y02E']",3,3,4,392,1
184,US11934843B2,Secure arbitration mode to build and operate within trust domain extensions ,Intel Corporation,"['Vedvyas Shanbhogue', ' Ravi L. Sahita', ' Vincent Scarlata', ' Barry E. Huntley']",2019-03-28,2023-04-26,2024-03-19,2024-03-19,https://patents.google.com/patent/US11934843B2/en,https://patentimages.storage.googleapis.com/8c/28/b2/0dae91a754a09b/US11934843-20240319-D00000.png,US,B2,"A processor includes a range register to store information that identifies a reserved range of memory associated with a secure arbitration mode (SEAM) and a core coupled to the range register. The core includes security logic to unlock the range register on a logical processor, of the processor core, that is to initiate the SEAM. The logical processor is to, via execution of the security logic, store, in the reserved range, a SEAM module and a manifest associated with the SEAM module, wherein the SEAM module supports execution of one or more trust domains; initialize a SEAM virtual machine control structure (VMCS) within the reserved range of the memory that is to control state transitions between a virtual machine monitor (VMM) and the SEAM module; and authenticate the SEAM module using a manifest signature of the manifest.","['B', 'H', 'Y']","['B82', 'H01', 'Y02']","['B82Y', 'H01L', 'Y02E']",3,3,3,328,0
185,US12004127B2,"Communication device, system and method for communication using feedback ",Koninklijke Philips N.V.,"['Baris GÖKTEPE', ' Thomas Fehrenbach', ' Cornelius Hellge', ' Thomas Schierl', ' Robin Thomas']",2017-07-13,2023-03-23,2024-06-04,2024-06-04,https://patents.google.com/patent/US12004127B2/en,https://patentimages.storage.googleapis.com/87/99/28/d36651806e72f6/US12004127-20240604-D00000.png,US,B2,Communication devices are provided that facilitate receiving information units and providing feedback to other communication devices.,"['H', 'Y']","['H01', 'H02', 'Y02']","['H01L', 'H02H', 'H02J', 'Y02A', 'Y02E']",2,3,5,439,0
186,US11797102B2,"Systems, methods, and apparatus for enhanced presentation remotes ",Science House LLC,"['James Jorasch', ' Michael Werner', ' Geoffrey Gelman', ' Isaac W. Hock', ' Gennaro Rendino', ' Christopher Capobianco']",2020-06-01,2023-01-18,2023-10-24,2023-10-24,https://patents.google.com/patent/US11797102B2/en,https://patentimages.storage.googleapis.com/36/5b/59/a61b1e41dd3891/US11797102-20231024-D00000.png,US,B2,"In accordance with some embodiments, systems, apparatus, interfaces, methods, and articles of manufacture are provided for ascertaining aspects of a presentation and/or of an audience member. A presentation remote can be used to obtain information about the presentation and provide it to the audience member.","['H', 'Y']","['H02', 'Y02']","['H02J', 'Y02B', 'Y02E', 'Y02P']",2,2,4,279,0
187,US11907869B2,System and method for a transportation or freight capacity exchange for one or more transportation or freight capacity units ,Circlesx Llc,['Erik M. Simpson'],2018-10-22,2023-02-12,2024-02-20,2024-02-20,https://patents.google.com/patent/US11907869B2/en,https://patentimages.storage.googleapis.com/40/f3/e6/27cb00d666399f/US11907869-20240220-D00000.png,US,B2,"Implementations of various methods and systems of a network, GPS system, mobile computing devices, servers, forward commodity market servers, grouping software for hubs, transparent open access pricing systems, blockchain audit and safety methods and systems, virtual hub systems, algorithm methods for no arbitrage conditions in a simple easy to use graphical user interface format for mobile or virtual computing over various mediums which are connected via a network to transact and trade transportation seats or capacity units in airline transport, subway transport, train transport, automobile transport, autonomous vehicle transport, taxi transport, space transport, package freight transport, tractor trailer freight transport, cargo freight transport, container freight transport, virtual transport, underground transport, ship or sea transport, public transport, private transport or drone transport on a computer, mobile computer device, audio computer device, virtual reality computer device or mixed reality computing device.","['H', 'Y']","['H02', 'H04', 'Y02']","['H02J', 'H02H', 'H02M', 'H04B', 'Y02B', 'Y02E']",2,3,6,373,0
